title,summary,n_enrolled,course_type,Level,subject,language,course_length,price,price_level
Finance for Everyone: Smart Tools for Decision-Making,In this introduction to finance course from Michigan learn to apply frameworks and smart tools for understanding and making everyday financial decisions.,45029,Self-paced on your time,Introductory,Business & Management,English,6,49,Low
Creating Innovative Business Models,"Build your capabilities to create a value proposition, team strategy, market strategy, and financial strategy to transform your ideas into a startup company or innovative corporate venture",12227,Self-paced on your time,Introductory,Business & Management,English,4,149,Medium
u.lab: Leading From the Emerging Future,"An introduction to leading profound social, environmental and personal transformation.",79424,Self-paced on your time,Introductory,Business & Management,English,14,99,Medium
Electric Cars: Introduction,"Get a basic understanding of electric cars and learn about leading technologies, development of profitable business models and effective policies.",56171,Self-paced on your time,Intermediate,Engineering,English,4,50,Low
Inteligencia Artificial para todos: Domina los fundamentos,"Aprende qué es la Inteligencia Artificial (IA) al comprender sus aplicaciones y conceptos claves, incluidos el aprendizaje automático, el aprendizaje profundo y las redes neuronales.",11764,Self-paced on your time,Introductory,Computer Science,Español,4,49,Low
Marketing Analytics,Develop quantitative models that leverage business data to forecast sales and support important marketing decisions.,55228,Instructor-led on a course schedule,Advanced,Business & Management,English,12,249,High
Introducción a la Regulación Emocional basada en Mindfulness,,20634,Self-paced on your time,Introductory,Health & Safety,Español,4,49,Low
Design Thinking Fundamentals,Learn how a user-centered approach and design thinking principles inspire innovative ideas to create desirable solutions.,56446,Self-paced on your time,Intermediate,Business & Management,English,6,299,High
Basic Spanish 3: Getting there,"Beginners course for learners of Spanish that focuses not only on language but also on cultural aspects, specifically designed for English speakers.",17569,Self-paced on your time,Introductory,Language,English,4,50,Low
Mi propia huerta orgánica,"Este curso está realizado por profesionales para todas aquellas personas que tienen ganas de tener una huerta orgánica, que consideran que es muy importante el cultivo, sus propias hortalizas, plantas aromáticas, frutales, beneficiosos para el cuidado de su salud y la economía familiar.",11346,Self-paced on your time,Introductory,Biology & Life Sciences,Español,4,29,Low
Sustainability in Architecture: An Interdisciplinary Introduction,This course introduces the basic elements and trendsthat define sustainability practices in Architecture today. Itfollows an interdisciplinary approach that includes performance assessment and urban policies.,31352,Self-paced on your time,Intermediate,Architecture,English,4,50,Low
Gestión de riesgos en proyectos de desarrollo,Aprende a gestionar anticipadamente los eventos positivos y negativos que pueden afectar la ejecución de un proyecto de desarrollo.,47676,Self-paced on your time,Intermediate,Business & Management,Español,10,25,Low
Python Data Structures,"The second course in Python for Everybody explores variables that contain collections of data like string, lists, dictionaries, and tuples. Learning how to store and represent and manipulate data collections while a program is running is an important part of learning how to program.",36369,Self-paced on your time,Introductory,Computer Science,English,7,49,Low
The Science and Business of Biotechnology,"Explore the latest scientific innovations in biotechnology, and novel business and financing models for commercializing them.",17039,Self-paced on your time,Intermediate,Business & Management,English,16,49,Low
Finance Essentials,Discover how to use fundamental finance tools in both management and MBA learning contexts and understand common financial situations faced in everyday life.,63666,Self-paced on your time,Introductory,Business & Management,English,6,79,Medium
Introduction to the Internet of Things (IoT),Gain an understanding of what the IoT is and the requirements to design your own IoT solutions. Start developing IoT ideas in your industry.,89421,Self-paced on your time,Introductory,Computer Science,English,6,149,Medium
'Talk to me': Improving mental health and suicide prevention in young adults,"As a student, parent, teacher, coach, or health professional, learn strategies to help improve the mental health of young people in your life, recognise concerning behaviours, and feel better prepared to have conversations about mental health.",11481,Self-paced on your time,Introductory,Health & Safety,English,6,139,Medium
Disaster Medicine Training,Welcome to Disaster Medicine Training. ,10937,Self-paced on your time,Introductory,Medicine,English,8,50,Low
Nutrition and Health: Human Microbiome,"Learn how you can impact your health by balancing your gut health; how your microbiome together with your diet can improve normal gut function. A balanced microbiome and nutritional intake can avoid disorders like IBS, obesity and diabetes.",44079,Self-paced on your time,Introductory,Health & Safety,English,6,49,Low
Customer Relationship Management,Learn to develop customer relationships through a deepened understanding of the concepts and best practices of CRM.,53085,Self-paced on your time,Intermediate,Business & Management,English,6,50,Low
Islam Through Its Scriptures,"Learn about the Quran, the central sacred text of Islam, through an exploration of the rich diversity of roles and interpretations in Muslim societies.",65430,Self-paced on your time,Introductory,Humanities,English,4,99,Medium
Mechatronics Revolution: Fundamentals and Core Concepts,"In this course, students will learn to harness the power of microcontrollers, sensors, and actuators to build useful and interesting robotic devices.",11619,Self-paced on your time,Introductory,Engineering,English,16,149,Medium
Accounting for Decision-Making,This course is part of a MicroMasters® Program,57710,Self-paced on your time,Intermediate,Business & Management,English,7,150,Medium
C Programming: Language Foundations,Master foundational concepts in the C programming language such as logical statements and arrays.,46400,Self-paced on your time,Introductory,Computer Science,English,7,49,Low
Big Data sin misterios,Transforma los datos en valor. Aprende el potencial de Big Data para aumentar la eficiencia y eficacia de tu organización en este MOOC desarrollado con Telefónica.,65564,Self-paced on your time,Intermediate,Data Analysis & Statistics,Español,10,25,Low
Becoming a Successful Leader (Inclusive Leadership Training),Become a successful leader by learning 21st-century leadership skills and applying concepts to the real world.,215705,Self-paced on your time,Introductory,Communication,English,4,49,Low
"English for Journalists, Part 1","Improve your English grammar, vocabulary and writing skills through exciting topics in journalism and world news.",50847,Self-paced on your time,Intermediate,Communication,English,5,139,Medium
Introduction to Networking,This is a self-paced course from NYU that provides an Introduction to Networking,16134,Self-paced on your time,Introductory,Computer Science,English,7,150,Medium
Accounting Essentials,An introduction to the financial and management accounting skills needed to succeed in both MBA study and in business.,58463,Self-paced on your time,Introductory,Business & Management,English,6,79,Medium
Introduction to Java Programming: Starting to code in Java,Learn to program with Java in an easy and interactive way!,325554,Self-paced on your time,Introductory,Computer Science,English,5,149,Medium
European Paintings: From Leonardo to Rembrandt to Goya,Uncover the meaning behind the art of the great painters from 1400 to 1800.,60734,Self-paced on your time,Introductory,Humanities,English,7,99,Medium
Java Programming Fundamentals,"Your career as a program developer starts here. Gain entry-level programing skills in Java language, and prepare yourself to handle any task that is required in any programming job.",12042,Self-paced on your time,Intermediate,Engineering,English,5,49,Low
"Hollywood: History, Industry, Art",,50033,Self-paced on your time,Introductory,Communication,English,4,169,High
Data Science Tools,"Learn about the most popular data science tools, including how to use them and what their features are.",15627,Self-paced on your time,Introductory,Data Analysis & Statistics,English,7,39,Low
Statistical Thinking for Data Science and Analytics,Learn how statistics plays a central role in the data science approach.,198861,Self-paced on your time,Introductory,Computer Science,English,5,99,Medium
Philosophy and Critical Thinking,,97175,Self-paced on your time,Introductory,Humanities,English,6,99,Medium
International Law,"Learn about the Law of the International Community, including how International Law is created, applied and upheld in today's world.",91868,Self-paced on your time,Advanced,Law,English,12,150,Medium
Tourism and Travel Management,Leading tourism practitioners and researchers offer insider perspectives on this dynamic and growing industry.,38503,Self-paced on your time,Introductory,Business & Management,English,7,5,Low
Project Management Life Cycle,"Learn how to apply project management tools, processes, and techniques for the successful execution of a project from initiation to closing.",120019,Self-paced on your time,Intermediate,Business & Management,English,10,150,Medium
Solar Energy,Discover the power of solar energy and learn how to design a complete photovoltaic system.,125069,Self-paced on your time,Introductory,Engineering,English,8,50,Low
Public Speaking,Build confidence as a speaker by learning how to use simple tools and skills to prepare and deliver memorable presentations.,10129,Self-paced on your time,Introductory,Communication,English,3,199,High
Japanese Pronunciation for Communication,Practice pronunciation and improve your spoken Japanese in context.,62757,Self-paced on your time,Introductory,Communication,日本語,5,99,Medium
Mindfulness and Resilience to Stress at Work,"Learn research-based strategies to help you foster mindfulness, handle stress, and guard against burnout.",33414,Self-paced on your time,Introductory,Business & Management,English,4,199,High
Framing Your Communication to Inspire and Convince,Discover how to gain support from management and motivate your teams by learning how to communicate effectively and strategically.,49351,Self-paced on your time,Intermediate,Business & Management,English,5,125,Medium
Business Foundations,This is business in a nutshell; learn key concepts and frameworks that underpin business.,55154,Self-paced on your time,Introductory,Business & Management,English,6,150,Medium
The Chemistry of Life,Learn how to generate ideas at the interface between chemistry and biology.,78704,Self-paced on your time,Introductory,Biology & Life Sciences,English,13,49,Low
Nutrition and Health: Micronutrients and Malnutrition,Learn about malnutrition and micronutrients and how they impact human health.,78266,Self-paced on your time,Intermediate,Biology & Life Sciences,English,7,99,Medium
Digital Design,"The course is an introduction to digital design technology. It allows you to understand the basics of digital design and helps you develop skills from computer aided design to animation covering topics such as rigging, key framing, rendering and more.",12339,Self-paced on your time,Introductory,Design,English,5,50,Low
Machine Learning for Data Science and Analytics,Learn the principles of machine learning and the importance of algorithms.,140419,Self-paced on your time,Introductory,Computer Science,English,5,99,Medium
The Science of Everyday Thinking,"Learn how to think better, argue better, and choose better.",318399,Self-paced on your time,Introductory,Business & Management,English,12,99,Medium
Gestion de projets de développement,Un MOOC conçu en collaboration avec le Project Management Institute Educational Foundation (PMI-EF).,41663,Self-paced on your time,Intermediate,Business & Management,Français,10,25,Low
Product Management Fundamentals,Understand the keys to successfully navigating the roles and responsibilities of being a product manager to champion change with internal and external collaborators and influencers,11913,Self-paced on your time,Introductory,Business & Management,English,4,199,High
International Human Rights Law,Learn how an individual’s human rights are protected from both public and private power by international laws.,74424,Self-paced on your time,Advanced,Law,English,12,150,Medium
The Best Start in Life: Early Childhood Development for Sustainable Development,Children are our future – so how do we give them the best beginning for a happy and healthy life?,23139,Self-paced on your time,Intermediate,Education & Teacher Training,English,8,49,Low
Data Science and Machine Learning Capstone Project,Create a project that you can use to showcase your Data Science skills to prospective employers. Apply various data science and machine learning techniques to analyze and visualize a data set involving a real life business scenario and build a predictive model.,21809,Self-paced on your time,Intermediate,Data Analysis & Statistics,English,6,99,Medium
"Data Science for Construction, Architecture and Engineering","This course introduces data science skills targeting applications in the design, construction, and operations of buildings. You will learn practical coding within this context with an emphasis on basic Python programming and the Pandas library.",11113,Self-paced on your time,Introductory,Data Analysis & Statistics,English,7,199,High
"Nutrition, Heart Disease and Diabetes","Discover the latest insights on the importance of nutrition and lifestyle in the development and treatment of cardiovascular diseases and diabetes mellitus in the online open course Nutrition, Heart disease and Diabetes.",24986,Self-paced on your time,Intermediate,Food & Nutrition,English,5,99,Medium
Project Management for Development,A MOOC developed in collaboration with the Project Management Institute Educational Foundation (PMIEF). Learn best practices for managing projects that promote economic and social development in Latin America and the Caribbean.,62099,Self-paced on your time,Intermediate,Business & Management,English,10,49,Low
Introduction to Cloud Infrastructure Technologies,"Learn the fundamentals of building and managing cloud technologies directly from The Linux Foundation, the leader in open source.",86923,Self-paced on your time,Introductory,Computer Science,English,14,169,High
"Circular Fashion: Design, Science and Value in a Sustainable Clothing Industry","The fundamentals of circular fashion unraveled, learn about circularity in all steps of the fashion value chain. From new textile materials and circular design all the way to business modelling.",13566,Self-paced on your time,Introductory,Art & Culture,English,5,65,Medium
Machine Learning,Master the essentials of machine learning and algorithms to help improve learning from data without human intervention.,150855,Instructor-led on a course schedule,Advanced,Computer Science,English,12,249,High
Introducción a la gestión de proyectos,Curso de introducción a la gestión de proyectos (project management) siguiendo la metodología del Project Management Institute (www.pmi.org).,98517,Self-paced on your time,Introductory,Business & Management,Español,5,50,Low
Free Cash Flow Analysis,Learn how to use the free cash flow method for firm valuation and how to compute and project free cash flows.,36085,Self-paced on your time,Introductory,Business & Management,English,5,225,High
Lean Production,"Learn how to apply key elements of Lean Production, from minimizing inventory and reducing setup times, to using 5S and Kaizen, in order to improve quality and productivity in your workplace.",55926,Self-paced on your time,Introductory,Business & Management,English,6,99,Medium
Introduction to Algebra,"Solve equations, draw graphs, and play with quadratics in this interactive course!",131197,Self-paced on your time,Introductory,Math,English,4,139,Medium
"LaTeX for Students, Engineers, and Scientists","Explore a new way of writing and typesetting articles, books, papers, etc. using a document preparation system called LaTeX.",11823,Self-paced on your time,Introductory,Engineering,English,7,139,Medium
Leading With Effective Communication (Inclusive Leadership Training),Develop communication skills that bring out the best in you — and in others.,107770,Self-paced on your time,Introductory,Communication,English,4,50,Low
Anatomy: Musculoskeletal and Integumentary Systems,"Learn about the integumentary system (skin, hair, nails, and glands), and how the bones, joints, and muscles of the musculoskeletal system function.",51969,Self-paced on your time,Introductory,Biology & Life Sciences,English,4,49,Low
"Inglés empresarial: ventas, gestión y liderazgo",Este curso en línea te permitirá aprender inglés y tener una inmersión del idioma en los negocios para sobresalir en tu carrera profesional.,10897,Instructor-led on a course schedule,Introductory,Business & Management,English,4,49,Low
Business Strategy from Wharton: Competitive Advantage,Learn how to develop and execute strategies to gain competitive advantage and improve your position in the marketplace.,26675,Self-paced on your time,Intermediate,Business & Management,English,6,199,High
Inteligencia emocional para el liderazgo efectivo y colaboración,"En este curso en línea aprenderás de que forma utilizar el liderazgo emocional efectivo como el factor clave para el éxito de un buen manejo de equipo, tanto en lo social como en lo profesional. Conviértete en un líder en control de sus emociones.",14726,Self-paced on your time,Introductory,Social Sciences,Español,4,49,Low
Introducción al desarrollo de aplicaciones web,,27757,Self-paced on your time,Introductory,Computer Science,Español,5,49,Low
"Six Sigma: Analyze, Improve, Control","Learn how to statistically analyze process data to determine the root cause and propose solutions for process problems, to implement quality management tools, such as 8D and the 5 Whys, and to understand the concept of Design for Six Sigma (DFSS).",56016,Self-paced on your time,Introductory,Business & Management,English,8,99,Medium
Introducción a la inteligencia emocional,"La inteligencia emocional es el factor clave para el exito personal, profesional y del equipo. En este curso en linea aprenderas como usarla para tu beneficio y construiras la base para el trabajo efectivo.",18830,Self-paced on your time,Introductory,Social Sciences,Español,4,49,Low
AP® Microeconomics,An overview of introductory microeconomics. Learn the key principles of economics and how to apply them to the real world - and the AP® exam!,53664,Self-paced on your time,Introductory,Economics & Finance,English,12,49,Low
Engineering Calculus and Differential Equations,"Learn fundamental concepts of single-variable calculus and ordinary differential equations, as well as their applications in engineering fields. Apply mathematical skills to model and solve engineering problems.",21535,Self-paced on your time,Introductory,Math,English,6,50,Low
Linear Algebra - Foundations to Frontiers,Learn the mathematics behind linear algebra and link it to matrix software development.,88570,Self-paced on your time,Intermediate,Computer Science,English,15,49,Low
Habilidades de negociación y comunicación efectiva,"Aprende a analizar la perspectiva “social” de una negociación y su impacto en acuerdos exitosos, así como los riesgos de ignorarla o desconocer su aplicabilidad.",19614,Self-paced on your time,Introductory,Business & Management,Español,4,149,Medium
Effective Communication for Today's Leader,Identify and develop the most important communication skills: assertiveness and empathy.,8862,Self-paced on your time,Intermediate,Business & Management,English,4,149,Medium
Electric Cars: Technology,Get an in-depth understanding of the technology behind electric cars.,40972,Self-paced on your time,Intermediate,Engineering,English,4,50,Low
Site Planning Online,"How to plan a site, its infrastructure and public spaces so that it is sustainable, supports human needs, compatible with its natural and man-made surroundings, adaptable and economically efficient. The course includes many examples of well planned sites.",12948,Self-paced on your time,Intermediate,Design,English,10,99,Medium
Macroeconometric Forecasting,Learn how to create and assess forecasting models to predict macroeconomic variables such as inflation and economic growth.,69358,Self-paced on your time,Intermediate,Economics & Finance,English,9,25,Low
Administración pública y fiscal: cómo se gestiona un gobierno,Aprenderás de manera sencilla y cercana como se mide la calidad de la administración pública y fiscal de tu pais y verás en que lugar se encuentra respecto al resto de América Latina y el Caribe.,49189,Self-paced on your time,Introductory,Economics & Finance,Español,10,25,Low
Fundamentals of Red Hat Enterprise Linux,,53788,Self-paced on your time,Introductory,Computer Science,English,9,99,Medium
Algorithms,Learn how to structure and use algorithms to solve real life problems.,61722,Self-paced on your time,Intermediate,Computer Science,English,6,149,Medium
Calculus Applied!,"Apply tools of single-variable calculus to create and analyze mathematical models used by real practitioners in social, life, and physical sciences.",54976,Self-paced on your time,Intermediate,Math,English,10,99,Medium
Precalculus,"This college-level, credit-eligible Precalculus course will teach you the skills required for success in future Calculus studies.",55576,Self-paced on your time,Intermediate,Math,English,15,49,Low
Fundamentos de anatomía y técnica quirúrgica básica,Aprende de una manera creativa y divertida cómo está constituido el cuerpo humano a través de casos clínicos seleccionados basados en hechos históricos reales. Además conocerás las bases anatómicas para la práctica de algunos procedimientos de emergencias que pueden llegar a salvar vidas.,12133,Instructor-led on a course schedule,Introductory,Medicine,Español,4,49,Low
Business Communications,Learn how to communicate effectively in a business setting: understand diverse audiences and build sound arguments.,60713,Self-paced on your time,Introductory,Business & Management,English,6,150,Medium
Italian Language and Culture: Intermediate (2019-2020),"Improve your Italian language skills and expand your vocabulary while you learn about Italian art, literature and contemporary society.",35058,Self-paced on your time,Intermediate,Language,Italiano,12,49,Low
International Women's Health and Human Rights,"This self-paced course provides an overview of women's health and human rights, beginning in infancy and childhood, then moving through adolescence, reproductive years and aging. We consider economic, social, political and human rights factors, and the challenges women face in maintaining health and managing their lives in the face of societal pressures and obstacles.",9796,Self-paced on your time,Introductory,Social Sciences,English,10,50,Low
Blockchain: Understanding Its Uses and Implications,"Understand exactly what a blockchain is, its impact and potential for change around the world, and analyze use cases in technology, business, and enterprise products and institutions.",66769,Self-paced on your time,Introductory,Business & Management,English,14,199,High
"A-level Mathematics for Year 12 - Course 1: Algebraic Methods, Graphs and Applied Mathematics Methods",,22366,Self-paced on your time,Intermediate,Math,English,7,49,Low
Blockchain Technology,This course is part of a Professional Certificate,55376,Self-paced on your time,Intermediate,Computer Science,English,6,99,Medium
Basics of Power BI,"This learning resource will give learners the knowledge and the confidence to use the Power BI tool over other methods of recording, visualising and presenting data such as PowerPoint presentations.",8314,Self-paced on your time,Introductory,Data Analysis & Statistics,English,2,49,Low
Preparing to Network in English,Learn the basics of networking while you grow your social network and professional connections. Practice speaking to improve your English language skills for increased success in job hunting.,34337,Self-paced on your time,Introductory,Language,English,6,149,Medium
Mandarin Chinese Essentials,"This course is your first crucial step to learning Mandarin Chinese. Learn essential skills for communicating in Chineseincluding tones, pinyin, grammar, characters, and basic structures all within the context of a business environment.",36665,Self-paced on your time,Introductory,Language,English,5,99,Medium
Human Rights: The Rights of Refugees,Take action for human rights. This course will teach you about the human rights of refugees and empower you to defend them.,84270,Self-paced on your time,Introductory,Humanities,English,3,49,Low
What do Architects and Urban Planners do?,Discover how spatial design professionals make a difference in society,11046,Self-paced on your time,Introductory,Architecture,English,3,49,Low
"U.S. Political Institutions: Congress, Presidency, Courts, and Bureaucracy",Examine the inner workings of the three branches of the U.S. Federal Government,22723,Self-paced on your time,Introductory,Social Sciences,English,4,49,Low
