title,summary,n_enrolled,course_type,Level,subject,language,course_length,price,price_level
How to Learn Online,Learn essential strategies for successful online learning,124980,Self-paced on your time,Introductory,Education & Teacher Training,English,2,49,Low
Programming for Everybody (Getting Started with Python),"This course is a ""no prerequisite"" introduction to Python Programming. You will learn about variables, conditional execution, repeated execution and how we use functions. The homework is done in a web browser so you can do all of the programming assignments on a phone or public computer.",293864,Self-paced on your time,Introductory,Computer Science,English,7,49,Low
CS50's Introduction to Computer Science,An introduction to the intellectual enterprises of computer science and the art of programming.,2442271,Self-paced on your time,Introductory,Computer Science,English,12,90,Medium
The Analytics Edge,"Through inspiring examples and stories, discover the power of data and use analytics to provide an edge to your career and your life.",129555,Instructor-led on a course schedule,Intermediate,Data Analysis & Statistics,English,13,199,High
Marketing Analytics: Marketing Measurement Strategy,This course is part of a MicroMasters® Program,81140,Self-paced on your time,Introductory,Computer Science,English,4,249,High
Introduction to Project Management,Learn the principles of project management and apply them in your own work and life.,301793,Self-paced on your time,Introductory,Business & Management,English,6,199,High
Leading High-Performing Teams,"Learn how to motivate, engage and empower people to build effective and high performing teams.",32847,Self-paced on your time,Intermediate,Communication,English,10,5,Low
The Foundations of Happiness at Work,Learn why happiness at work matters and how to increase it within yourself and across your organization.,67073,Self-paced on your time,Introductory,Business & Management,English,4,199,High
"Managing Study, Stress and Mental Health at University","Develop a clearer understanding of what mental health is, and learn how best to recognise and respond to mental health concerns, such as negative thoughts and behaviours, in yourself and others.",23061,Self-paced on your time,Introductory,Health & Safety,English,2,49,Low
Six Sigma: Define and Measure,"An introduction to the Six Sigma methodology and the DMAIC cycle for process improvement with a focus on the Define and Measure phases, including basic statistics for understanding sampling plans and calculating process capability.",92411,Self-paced on your time,Introductory,Business & Management,English,8,99,Medium
Fat Chance: Probability from the Ground Up,Increase your quantitative reasoning skills through a deeper understanding of probability and statistics.,66835,Self-paced on your time,Introductory,Math,English,7,49,Low
Chasing your Dream: How to End Procrastination and Get a Job You Love,"According to the old saying, ""Choose a job you love, and you will never have to work a day in your life."" This courseis geared toward helping you find real purpose in your work and becoming the best version of yourself.",44711,Self-paced on your time,Introductory,Communication,English,5,49,Low
Bitcoin and Cryptocurrencies,This course is part of a Professional Certificate,83398,Self-paced on your time,Introductory,Computer Science,English,6,99,Medium
English Grammar and Style,Learn key concepts and strategies in grammar and style to help enhance your writing and confidently respond to the demand of high levels of literacy in the 21st century.,0,Instructor-led on a course schedule,Introductory,Humanities,English,8,99,Medium
Ethics in Action,What do the world's great religious and secular philosophies have to say about ethical conduct? Which virtues are common across faiths? And what role do religious communities have to play in building a more just and sustainable world?,6366,Self-paced on your time,Intermediate,Ethics,English,10,49,Low
Introduction to FinTech,"Learn from leading academics and practitioners from around the world about the innovations, technology and regulation driving the transformation of finance.",72767,Self-paced on your time,Introductory,Economics & Finance,English,6,199,High
Data Science: R Basics,"Build a foundation in R and learn how to wrangle, analyze, and visualize data.",528782,Self-paced on your time,Introductory,Data Analysis & Statistics,English,8,49,Low
Python Basics for Data Science,"This Python course provides a beginner-friendly introduction to Python for Data Science. Practice through lab exercises, and you'll be ready to create your first Python scripts on your own!",228809,Self-paced on your time,Introductory,Data Analysis & Statistics,English,5,39,Low
The Science of Beer,"Are you interested in more than just the taste of beer? Discover what's in your beer, howit's made and marketed and the effectit hason your body and health.",39085,Self-paced on your time,Introductory,Food & Nutrition,English,6,49,Low
Strategic Social Media Marketing,Learn how to drive social media engagement by linking strategy and tactics and measuring results.,103640,Instructor-led on a course schedule,Advanced,Business & Management,English,6,399,High
CS50's Introduction to Artificial Intelligence with Python,Learn to use machine learning in Python in this introductory course on artificial intelligence.,258006,Self-paced on your time,Introductory,Computer Science,English,7,199,High
CS50's Introduction to Game Development,This course is part of a Professional Certificate,346748,Self-paced on your time,Intermediate,Computer Science,English,12,149,Medium
Rhetoric: The Art of Persuasive Writing and Public Speaking,Gain critical communication skills in writing and public speaking with this introduction to American political rhetoric.,320225,Self-paced on your time,Introductory,Humanities,English,8,99,Medium
CS50's Web Programming with Python and JavaScript,"This course picks up where CS50 leaves off, diving more deeply into the design and implementation of web apps with Python, JavaScript, and SQL using frameworks like Django, React, and Bootstrap.",698950,Self-paced on your time,Intermediate,Computer Science,English,12,90,Medium
Contract Law: From Trust to Promise to Contract,"Contracts are a part of our everyday life, arising in collaboration, trust, promise and credit. How are contracts formed? What makes a contract enforceable? What happens when one party breaks a promise?",414181,Self-paced on your time,Intermediate,Business & Management,English,8,125,Medium
"Fundamentals of Neuroscience, Part 1: The Electrical Properties of the Neuron",Learn how electricity makes the neurons in your brain tick.,380167,Self-paced on your time,Introductory,Biology & Life Sciences,English,5,99,Medium
Justice,This introduction to moral and political philosophy is one of the most popular courses taught at Harvard College.,392588,Self-paced on your time,Introductory,Humanities,English,12,99,Medium
Data Science: Machine Learning,Build a movie recommendation system and learn the science behind one of the most popular and successful data science techniques.,276209,Self-paced on your time,Introductory,Data Analysis & Statistics,English,8,49,Low
Child Protection: Children's Rights in Theory and Practice,"Learn how to protect children from violence, exploitation, and neglect through law, policy, and practice in a human rights framework.",212453,Self-paced on your time,Introductory,Social Sciences,English,16,99,Medium
IELTS Academic Test Preparation,"Prepare for the IELTS Academic tests in this comprehensive, self-paced course covering listening, speaking, reading and writing.",1103777,Self-paced on your time,Introductory,Communication,English,8,99,Medium
The Architectural Imagination,Learn fundamental principles of architecture — as an academic subject or a professional career — by studying some of history’s most important buildings.,406181,Self-paced on your time,Introductory,Architecture,English,10,99,Medium
TOEFL® Test Preparation: The Insider’s Guide,Prepare for the TOEFL® test and learn how to improve your score and English language skills from the experts who create the exam.,1022489,Self-paced on your time,Introductory,Communication,English,6,49,Low
Principles of Biochemistry,"This introduction to biochemistry explores the molecules of life, starting at simple building blocks and culminating in complex metabolism.",257600,Self-paced on your time,Intermediate,Medicine,English,15,199,High
Using Python for Research,Take your introductory knowledge of Python programming to the next level and learn how to use Python 3 for your research.,262183,Self-paced on your time,Intermediate,Computer Science,English,12,99,Medium
Hinduism Through Its Scriptures,"Learn about the rich diversity of Hindu sacred texts – hymns, narratives, philosophical thought – and their interpretations.",140782,Self-paced on your time,Introductory,Humanities,English,4,99,Medium
Basic Spanish 1: Getting Started,"Learn Spanish and explore Spanish culture in this introductory language course, designed for English speakers.",400169,Self-paced on your time,Introductory,Communication,English,7,40,Low
The Health Effects of Climate Change,"Learnhow global warming impacts human health, and the wayswe can diminish those impacts.",110024,Self-paced on your time,Introductory,Environmental Studies,English,7,99,Medium
Inglés básico: conversacional y networking,Cumple tu meta de aprender inglés básico para utilizarlo de forma estratégica en los negocios e incrementar tu éxito profesional.,79671,Self-paced on your time,Introductory,Business & Management,Español,4,49,Low
Statistics and R,An introduction to basic statistical concepts and R programming skills necessary for analyzing data in the life sciences.,314586,Self-paced on your time,Intermediate,Data Analysis & Statistics,English,4,249,High
Science & Cooking: From Haute Cuisine to Soft Matter Science (chemistry),"Top chefs and Harvard researchers explore how everyday cooking and haute cuisine can illuminate basic principles in chemistry, physics, and engineering. Learn about food molecules and how chemical reactions can affect food texture and flavor.",145011,Self-paced on your time,Introductory,Chemistry,English,16,199,High
Pyramids of Giza: Ancient Egyptian Art and Archaeology,"Explore the archaeology, history, art, and hieroglyphs surrounding the famous Egyptian Pyramids at Giza. Learn about Old Kingdom pharaohs and elites, tombs, temples, the Sphinx, and how new technology is unlocking their secrets.",123870,Self-paced on your time,Introductory,Art & Culture,English,8,99,Medium
"PredictionX: Omens, Oracles & Prophecies","This course is an overview of divination systems, ranging from ancient Chinese bone burning to modern astrology.",91566,Self-paced on your time,Introductory,Social Sciences,English,1,25,Low
Excel: Fundamentos y herramientas,"En este curso aprenderás las herramientas más habituales de Microsoft Excel, desde lo más básico a los gráficos, funciones y tablas de datos.",284279,Self-paced on your time,Introductory,Computer Science,Español,8,50,Low
Lessons from Ebola: Preventing the Next Pandemic,"Understanding the context for the Ebola outbreak: What went right, what went wrong, and how we can all do better.",91983,Self-paced on your time,Introductory,Social Sciences,English,4,49,Low
Improving Global Health: Focusing on Quality and Safety,An introduction to the emerging field of global healthcare quality.,127353,Self-paced on your time,Intermediate,Social Sciences,English,10,99,Medium
CS50 for Lawyers,,87336,Self-paced on your time,Introductory,Computer Science,English,10,99,Medium
Data Science: Visualization,Learn basic data visualization principles and how to apply them using ggplot2.,171258,Self-paced on your time,Introductory,Data Analysis & Statistics,English,8,49,Low
Christianity Through Its Scriptures,"Learn about Christianity through a study of its sacred scriptures. We will explore how diverse Christians have interpreted these writings and practiced their teachings over a 2000 year, global history.",125051,Self-paced on your time,Introductory,Humanities,English,4,99,Medium
The Science of Happiness,"The first MOOC to teach positive psychology. Learn science-based principles and practices for a happy, meaningful life.",475614,Self-paced on your time,Introductory,Social Sciences,English,11,169,High
Leaders of Learning,Explore and understand your own theories of learning and leadership. Gain the tools to imagine and build the future of learning.,231131,Self-paced on your time,Introductory,Communication,English,10,99,Medium
Exercising Leadership: Foundational Principles,Mobilize people to tackle tough problems and build the capacity to thrive through the dangers of change,57814,Self-paced on your time,Introductory,Business & Management,English,4,99,Medium
Data Science: Probability,Learn probability theory -- essential for a data scientist -- using a case study on the financial crisis of 2007-2008.,135859,Self-paced on your time,Introductory,Data Analysis & Statistics,English,8,49,Low
Introduction to Data Wise: A Collaborative Process to Improve Learning & Teaching,,117410,Self-paced on your time,Intermediate,Education & Teacher Training,English,10,70,Medium
"Prescription Drug Regulation, Cost, and Access: Current Controversies in Context","Understand how the FDA regulates pharmaceuticals and explore debates on prescription drug costs, marketing, and testing.",80082,Self-paced on your time,Introductory,Medicine,English,8,99,Medium
Introduction to Family Engagement in Education,Learn about successful collaborations between families and educators and why they lead to improved outcomes for students and schools.,105146,Self-paced on your time,Introductory,Education & Teacher Training,English,6,70,Medium
Italian Language and Culture: Beginner (2019-2020),"Learn the basics of the Italian language and culture through videos, podcasts, interviews, and much more.",182462,Self-paced on your time,Introductory,Language,Italiano,12,49,Low
Steps in Japanese for Beginners1 Part1,Learn basic Japanese expressions to survive in Japanese.,53630,Self-paced on your time,Introductory,Language,English,5,49,Low
How to Write an Essay,"An introduction to academic writing for English Language Learners, focusing on essay development, grammatical correctness, and self-editing.",306787,Self-paced on your time,Introductory,Humanities,English,5,49,Low
Energy Within Environmental Constraints,A quantitative introduction to the energy system and its environmental impacts.,95324,Self-paced on your time,Introductory,Environmental Studies,English,10,99,Medium
Introduction to Probability,"Learn probability, an essential language and set of tools for understanding data, randomness, and uncertainty.",97291,Self-paced on your time,Intermediate,Data Analysis & Statistics,English,10,99,Medium
AnatomyX: Musculoskeletal Cases,Learn the anatomy basic to understanding five musculoskeletal injuries commonly seen in primary care medicine and orthopedic clinical specialty practice. Follow hypothetical patients from injury to operating room.,102075,Self-paced on your time,Intermediate,Medicine,English,7,99,Medium
Data Science: Inference and Modeling,"Learn inference and modeling, two of the most widely used statistical tools in data analysis.",88256,Self-paced on your time,Introductory,Data Analysis & Statistics,English,8,49,Low
Strengthening Community Health Worker Programs,Learn to deliver high-quality primary health care at scale through national community health worker programs.,58626,Self-paced on your time,Introductory,Health & Safety,English,6,79,Medium
Buddhism Through Its Scriptures,"Learn about the rich and diverse beliefs and practices of Buddhists across time and place. Experience Buddhism through its scriptures, both relationally as well as academically.",182295,Self-paced on your time,Introductory,Humanities,English,4,99,Medium
Introduction to Linux,Never learned Linux? Want a refresh? Develop a good working knowledge of Linux using both the graphical interface and command line across the major Linux distribution families.,642088,Self-paced on your time,Introductory,Computer Science,English,14,199,High
"Bioethics: The Law, Medicine, and Ethics of Reproductive Technologies and Genetics",An introduction to the study of bioethics and the application of legal and ethical reasoning.,81221,Self-paced on your time,Introductory,Medicine,English,10,99,Medium
Shakespeare's Life and Work,"Learn how to read William Shakespeare's plays through his biography, Elizabethan and Jacobean history, and modern performance.",48938,Self-paced on your time,Introductory,Humanities,English,4,49,Low
Marketing Digital: Content & Community Manager,"Aprende a crear estrategias de marketing de contenidos y domina Facebook, Instagram, YouTube, Twitter y más. Mide KPIs y obten resultados.",112623,Self-paced on your time,Introductory,Communication,Español,5,49,Low
Accounting and Finance,Develop financial acumen to manage your business successfully.,88243,Self-paced on your time,Intermediate,Business & Management,English,11,150,Medium
Computing in Python I: Fundamentals and Procedural Programming,"Learn the fundamentals of computing in Python, including variables, operators, and writing and debugging your own programs.",141966,Self-paced on your time,Introductory,Computer Science,English,5,99,Medium
"Nutrition, Exercise and Sports","Learn about Nutrition, Exercise and Sports and understand how nutrition can support exercise and sports performance.",51679,Self-paced on your time,Intermediate,Food & Nutrition,English,6,49,Low
Becoming an Entrepreneur,"Learn the business skills and startup mindset needed to embark on your entrepreneurial path from the premier program for aspiring entrepreneurs, MIT Launch.",104760,Self-paced on your time,Introductory,Business & Management,English,6,69,Medium
"Religion, Conflict and Peace",Explore the diverse and complex roles that religions play in both promoting and mitigating violence.,74060,Self-paced on your time,Introductory,Humanities,English,8,49,Low
"Tangible Things: Discovering History Through Artworks, Artifacts, Scientific Specimens, and the Stuff Around You","Gain an understanding of history, museum studies, and curation by looking at, organizing, and interpreting art, artifacts, scientific curiosities, and the stuff of everyday life.",61139,Self-paced on your time,Introductory,Humanities,English,10,49,Low
Academic and Business Writing,"An introduction to academic and business writing for English Language Learners, focusing on grammar, vocabulary, structure, editing, and publication.",322701,Self-paced on your time,Introductory,Communication,English,6,49,Low
Data Science: Capstone,Show what you've learned from the Professional Certificate Program in Data Science.,62803,Self-paced on your time,Introductory,Data Analysis & Statistics,English,2,99,Medium
Basics of Computing and Programming,This is a self-paced course from NYU that provides an Introduction to Computing and Programming,37045,Self-paced on your time,Introductory,Computer Science,English,9,200,High
"Fundamentals of Neuroscience, Part 2: Neurons and Networks",Discover how neurons work together to create complex networks inside the brain.,84874,Self-paced on your time,Introductory,Biology & Life Sciences,English,6,99,Medium
Successful Negotiation: Essential Strategies and Skills,Build negotiation skills and learn how to use and apply negotiation strategies to your life with the University of Michigan.,31369,Self-paced on your time,Introductory,Business & Management,English,7,49,Low
Data Science: Linear Regression,"Learn how to use R to implement linear regression, one of the most common statistical modeling approaches in data science.",75310,Self-paced on your time,Introductory,Data Analysis & Statistics,English,8,49,Low
HTML5 and CSS Fundamentals,"Learn how to build Web sites using HTML5 and basic CSS, directly from W3C, creator of the latest Web standards.",335895,Self-paced on your time,Introductory,Computer Science,English,6,199,High
Data Science: Productivity Tools,"Keep your projects organized and produce reproducible reports using GitHub, git, Unix/Linux, and RStudio.",66683,Self-paced on your time,Introductory,Data Analysis & Statistics,English,8,49,Low
Introduction to Corporate Finance,"Learn key financial concepts for evaluating and valuing investment opportunities, including how to value stocks and bonds.",98093,Self-paced on your time,Introductory,Business & Management,English,4,225,High
Computer Science 101,Introduction to Computer Science for a zero-prior-experience audience. Play with little phrases of code to understand what computers are all about.,39540,Self-paced on your time,Introductory,Computer Science,English,6,149,Medium
Data Science: Wrangling,Learn to process and convert raw data into formats needed for analysis.,64584,Self-paced on your time,Introductory,Data Analysis & Statistics,English,8,49,Low
A Hands-on Introduction to Engineering Simulations,Learn how to analyze real-world engineering problems using ANSYS simulation software and gain important professional skills sought by employers.,187138,Self-paced on your time,Intermediate,Engineering,English,6,199,High
AI for Everyone: Master the Basics,"Learn what Artificial Intelligence (AI) is by understanding its applications and key concepts including machine learning, deep learning and neural networks.",49340,Self-paced on your time,Introductory,Computer Science,English,4,49,Low
The Psychology of Criminal Justice,Learn how behavioural science can improve our criminal justice system.,110086,Self-paced on your time,Introductory,Humanities,English,8,99,Medium
Machine Learning with Python: A Practical Introduction,Machine Learning can be an incredibly beneficial tool to uncover hidden insights and predict future trends. This Machine Learning with Python course will give you all the tools you need to get started with supervised and unsupervised learning.,80161,Self-paced on your time,Introductory,Data Analysis & Statistics,English,5,39,Low
Analyzing Data with Python,"In this course, you will learn how to analyze data in Python using multi-dimensional arrays in numpy, manipulate DataFrames in pandas, use SciPy library of mathematical routines, and perform machine learning using scikit-learn!",94079,Self-paced on your time,Introductory,Data Analysis & Statistics,English,5,39,Low
Excel: gestión de datos,"En este curso profundizarás en las técnicas y herramientas para el tratamiento, manejo y análisis de datos que puedes utilizar en Microsoft Excel para la toma de decisiones.",111785,Self-paced on your time,Intermediate,Computer Science,Español,6,75,Medium
Probability - The Science of Uncertainty and Data,"Build foundational knowledge of data science with this introduction to probabilistic models, including random processes and the basic elements of statistical inference -- Part of the MITx MicroMasters program in Statistics and Data Science.",205615,Instructor-led on a course schedule,Advanced,Data Analysis & Statistics,English,16,300,High
"Fundamentals of Neuroscience, Part 3: The Brain",Discover what makes your brain tick in this third course in our introductory series in neuroscience.,85034,Self-paced on your time,Introductory,Biology & Life Sciences,English,8,99,Medium
Sikhism Through Its Scriptures,This course examines the Sikh scripture from a doctrinal and historical perspective by providing an overview of Sikh teachings as well as the historical context within which the scripture evolved and became canonized.,44125,Self-paced on your time,Introductory,Humanities,English,4,99,Medium
Upper-Intermediate English: Business and Modern Life,"Advance your English languageskillsas you learn how to rephrase sentences andprepare for an interview. Topics such as films, sports, and natural resources will also be discussed.",77991,Self-paced on your time,Intermediate,Language,English,4,50,Low
Introduction to Probability,"Learn probability, an essential language and set of tools for understanding data, randomness, and uncertainty.",97291,Self-paced on your time,Intermediate,Data Analysis & Statistics,English,10,99,Medium
Religious Literacy: Traditions and Scriptures,Learn how to better understand the rich and complex ways that religions function in historic and contemporary contexts.,96972,Self-paced on your time,Introductory,Humanities,English,4,99,Medium
Programación para todos (empezando con Python),"Este curso en línea es una introducción ""sin prerrequisitos"" a la programación en Python. Aprenderás sobre las variables, la ejecución condicional, la ejecución repetida y cómo usamos las funciones.",81004,Self-paced on your time,Introductory,Computer Science,Español,7,49,Low
Analyzing and Visualizing Data with Power BI,Step up your analytics game and learn one of the most in-demand job skills in the United States.,28879,Self-paced on your time,Introductory,Data Analysis & Statistics,English,4,99,Medium
High-Dimensional Data Analysis,A focus on several techniques that are widely used in the analysis of high-dimensional data.,78443,Self-paced on your time,Advanced,Data Analysis & Statistics,English,4,149,Medium
Introduction To Music Theory,"Learn key concepts and approaches needed to understand, create, and perform contemporary music.",67029,Self-paced on your time,Introductory,Humanities,English,6,49,Low
Human Anatomy,The first MOOC to teach Human Anatomy from multiple healthcare professional perspectives through a case-based study of stroke.,126850,Self-paced on your time,Introductory,Medicine,English,8,139,Medium
"CitiesX: The Past, Present and Future of Urban Life","Explore what makes cities energizing, amazing, challenging, and perhaps humanity’s greatest invention.",76874,Self-paced on your time,Introductory,Social Sciences,English,11,99,Medium
