title,summary,n_enrolled,course_type,Level,subject,language,course_length,price,price_level
Análisis e interpretación de información económica y financiera,"Desarrolla un entendimiento más amplio y completo de los mercados financieros, la política monetaria, la política fiscal, las variables económicas y cómo interactúan entre ellos afectando variables como los precios y la toma de decisiones de los agentes.",5891,Self-paced on your time,Intermediate,Economics & Finance,Español,5,49,Low
AWS IoT: Developing and Deploying an Internet of Things,,8884,Self-paced on your time,Intermediate,Computer Science,English,4,99,Medium
Measuring Sustainable Development,"The United Nations Sustainable Development Goals are an ambitious global agenda for prosperity, people, and planet. But how do we know if we are on track to achieve the SDGs? Which Goals should different stakeholders prioritize? And what kind of data do we need to ensure that no one is left behind?",0,Self-paced on your time,Intermediate,Data Analysis & Statistics,English,5,25,Low
Embedded Systems - Shape The World: Multi-Threaded Interfacing,,27814,Self-paced on your time,Intermediate,Computer Science,English,8,49,Low
Hong Kong Cinema through a Global Lens | 全球化下的香港电影,"Explore globalization through Hong Kong film classics of Bruce Lee, Jackie Chan, and Maggie Cheung, among others. 透过李小龙、成龙和张曼玉等国际巨星曾演出的经典香港电影，探索全球一体化概念。",12458,Instructor-led on a course schedule,Introductory,Humanities,English,6,50,Low
Image Processing and Analysis for Life Scientists,Basic image analysis for life scientists with a non-engineering background. The main goal is to teach how to address and solve scientific questions by state of the art image analysis strategies.,8621,Self-paced on your time,Intermediate,Data Analysis & Statistics,English,7,199,High
La protección del menor,,7654,Self-paced on your time,Introductory,Law,Español,5,49,Low
Globalization: Past and Future,Is globalization a new phenomenon or a cyclical pattern throughout human history?,10127,Self-paced on your time,Introductory,History,English,4,25,Low
Star Trek: Inspiring Culture and Technology,Explore the impact and influence of Star Trek on today's society and technology.,6521,Self-paced on your time,Introductory,History,English,7,40,Low
Qué funciona en educación: políticas educativas basadas en evidencia,"Aprende qué funciona en educación: cómo identificar, analizar e implementar políticas educativas que efectivamente mejoran aprendizajes.",15701,Self-paced on your time,Introductory,Education & Teacher Training,Español,10,25,Low
"Introduction to Cloud Development with HTML5, CSS3, and JavaScript","Learn the key tools and programming languages to bootstrap your career as a Cloud Developer. Get started with web development using HTML5, CSS3, JavaScript and GitHub.",0,Self-paced on your time,Introductory,Computer Science,English,4,99,Medium
Tools for Academic Engagement in Public Policy,"Many scientists and engineers seek to engage with policymakers and there is a clear need for them to do so. However, very few receive the training necessary to effectively impact public policy. This online module will provide an introduction to the policymaking process and practical tips for engaging with the policy community.",5035,Self-paced on your time,Introductory,Communication,English,3,199,High
Theory of Change for Development,Learn to use a Theory of Change approach to betterunderstand your development program's impact and improve your results.,10736,Self-paced on your time,Introductory,Social Sciences,English,7,199,High
Monozukuri: Making Things,"Learn the Japanese concept of Monozukuri: the art of ""making things"" starting with the philosophy including lectures from Tokyo Tech faculty, various examples from Japanese Industry, and the Tokyo Tech student clubs. In addition, the principles of experiental learning are also introduced.",0,Self-paced on your time,Introductory,Engineering,English,4,49,Low
Drug Discovery & Medicinal Chemistry,Learn how scientists in drug development modify and test molecules to improve potency and reduce toxicity. Discover the criteria that regulatory agencies use to approve molecules that are shown to be both safe and effective as pharmaceuticals for the treatment and prevention of diseases.,0,Self-paced on your time,Intermediate,Medicine,English,5,99,Medium
Digital Biomaterials,"Learn and discover the special, exciting and new materials and technologies in dentistry to make a difference in tomorrow’s oral health care development. It is Digital Biomaterials by HKU Dental Materials Science!",0,Self-paced on your time,Introductory,Medicine,English,4,149,Medium
Natural Resources for Sustainable Development,"Explore the sustainable development opportunities and challenges in using oil, gas and minerals.",9668,Self-paced on your time,Intermediate,Energy & Earth Sciences,English,12,49,Low
Omnichannel Strategy and Management,Understand the needs of omnichannel customers and how to make the transition from a traditional retailer to omnichannel from TuckX and the Tuck School of Business at Dartmouth.,15860,Self-paced on your time,Intermediate,Business & Management,English,4,99,Medium
General Overview of Cannabis and the Industry’s Outlook and Professions,An in-depth view of cannabis and its potential uses.,5048,Self-paced on your time,Introductory,Environmental Studies,English,4,199,High
Amazon SageMaker: Simplifying Machine Learning Application Development,Learn to integrate Machine Learning into your apps with training from AWS experts--and without a data science background.,11765,Self-paced on your time,Intermediate,Computer Science,English,4,99,Medium
Formulación y nomenclatura de compuestos químicos,Aprenderemos cómo establecer las fórmulas de los compuestos químicos inorgánicos y orgánicos más usuales y las reglas para nombrarlos.,12748,Self-paced on your time,Introductory,Chemistry,Español,6,49,Low
Introducción a la factura electrónica,"Conoce los beneficios de la facturación electrónica. La implementación de la misma, busca facilitar la relación entre quienes facturan electrónicamente y quienes adquieren bienes que son facturados por ese medio.",5829,Self-paced on your time,Intermediate,Economics & Finance,Español,4,49,Low
Demand and Supply Analytics,Learn how to use data to develop insights and predictive capabilities to make better business decisions.,23585,Instructor-led on a course schedule,Intermediate,Business & Management,English,12,249,High
Advanced Algorithmics and Graph Theory with Python,"Strengthen your skills in algorithmics and graph theory, and gain experience in programming in Python along the way.",13502,Self-paced on your time,Intermediate,Computer Science,English,6,49,Low
Modern Japanese Architecture Part 1: From Meiji Restoration to the Pacific War,,0,Self-paced on your time,Intermediate,Architecture,English,5,59,Medium
Diagramas UML estructurales para la Ingeniería del Software,En la era de la información el desarrollo de software de calidad es un factor esencial. Desarrollar software de calidad implica conocer los modelos que dan lugar a dicho software.UMLes un estándar que permite abordar ese problemaen todos sus niveles.,5820,Self-paced on your time,Introductory,Computer Science,Español,5,50,Low
"A-level Mathematics for Year 12 - Course 2: Calculus, Newton’s Laws and Hypothesis Testing",,6232,Self-paced on your time,Intermediate,Math,English,7,49,Low
Fundamentos de Mecánica para Ingeniería,"Estudiaremos la cinemática y la dinámica del punto, los conceptos de trabajo y potencia y la energía mecánica.",14219,Self-paced on your time,Introductory,Physics,Español,6,49,Low
Leadership and Management for PM Practitioners in IT,Learn how to develop effective project management and leadership skills that are essential for successfully guiding diverse or distributed teams and projects.,21949,Self-paced on your time,Introductory,Business & Management,English,6,199,High
Entrepreneurship 103: Show Me The Money,"Your startup needs to get cash positive as soon as possible – and ultimately, profitable. This is how you get there.",15184,Self-paced on your time,Introductory,Business & Management,English,10,300,High
Historia de la ética,Una mirada hacia el pasado de la ética para poder afrontar mejor los problemas del futuro. Una visión crítica de la ética y la moral sin olvidar el sentido del humor.,9383,Self-paced on your time,Introductory,Philosophy & Ethics,Español,6,29,Low
Drainage in Agriculture: controlling water and salt levels in the soil,Get prepared for heavier rainfall and the increasing demand for food! The #1 Agricultural University of the world will teach you how to design and implement effective drainage systems in agriculture. You will learn how to create a perfect soil profile for optimal growing conditions for a crop and help feed the growing world population. Enrol now and prepare for the effects of climate change by draining excess water.,0,Self-paced on your time,Advanced,Environmental Studies,English,5,49,Low
Radio para internet con Podcast: creación y conceptos básicos,,6460,Self-paced on your time,Introductory,Communication,Español,6,50,Low
Introducción a los circuitos eléctricos,Curso introductorio de análisis de circuitos resistivos en corriente DC (corriente continua). Aprende la base fundamental del diseño de hardware relacionada a los circuitos.,11953,Self-paced on your time,Intermediate,Electronics,Español,5,49,Low
AP® Physics 1: Challenging Concepts,Master the most difficult topics in your AP® Physics 1 course with help from experienced AP® Physics teachers.,12145,Self-paced on your time,Introductory,Physics,English,8,49,Low
Introduction to Java Programming – Part 2,The first MOOC to teach the fundamental elements of Java programming and data abstraction.,71203,Self-paced on your time,Introductory,Computer Science,English,5,99,Medium
AP® Macroeconomics,Learn all material in the AP® Macroeconomics curriculum from highly regarded AP instructors and college professors.,29433,Self-paced on your time,Introductory,Economics & Finance,English,18,49,Low
Climate Change Education,Learn how to work with your students to help them explore climate change through the use of interactive and engaging activities. These activities are designed for students at the primary and secondary levels.,12056,Self-paced on your time,Introductory,Education & Teacher Training,English,10,25,Low
"Introducción al griego clásico: verbos, oraciones y filosofía","Continua tu periplo aprendiendo lo esencial del sistema verbal del griego clásico y de su sintaxis de la mano de contenidos culturales relacionados con la filosofía, la política y el amor en la Antigüedad.",0,Self-paced on your time,Introductory,Language,Español,5,49,Low
Applied Deep Learning Capstone Project,"In this capstone project, you'll use either Keras or PyTorch to develop, train, and test a Deep Learning model. Load and preprocess data for a real problem, build the model and then validate it.",8429,Self-paced on your time,Advanced,Data Analysis & Statistics,English,5,99,Medium
FinTech Ethics and Risks,"Learn how individuals and organizations can utilize and regulate blockchain, AI, and other FinTech solutions to ensure their adoption does not come at the expense of societal growth.",10696,Self-paced on your time,Introductory,Economics & Finance,English,6,199,High
User Experience (UX) Design: Human Factors and Culture in Design | 设计的人因与文化,"Learn user experience and user interface design-key skills to succeed as a product manager, developer and designer. 本课程将依托于实际的设计案例和有趣的文化现象，引导学生从文化的视角运用人因学的知识和方法理解什么是以用户为中心的设计理念，掌握科学的设计和评估方法",23828,Self-paced on your time,Advanced,Engineering,English,7,139,Medium
The Conquest of Space: Space Exploration and Rocket Science,Explore the history of space travel and learn the basics of aerospace engineering.,19926,Self-paced on your time,Introductory,Engineering,English,7,129,Medium
Business Strategy and Operations in a Biobased Economy,Lead your company to make the switch to biobased resources and build a profitable sustainable business. Learn how to deal with the many strategic and operational challenges facing a companyin the biobased and circular economy.,0,Self-paced on your time,Advanced,Business & Management,English,5,149,Medium
What Works in Education: Evidence-Based Education Policies,"Learn what works in education and how to identify, analyze and implement evidence-based education policies that improve learning.",5540,Self-paced on your time,Introductory,Education & Teacher Training,English,10,25,Low
Electric Cars: Business,Get an in-depth understanding of varied profitable business models for electric cars.,14199,Self-paced on your time,Intermediate,Business & Management,English,4,50,Low
Thermodynamics of Materials,Thermodynamics of Materials describes the fundamental competition between energy and disorder that determines the state of materials at equilibrium.,0,Self-paced on your time,Intermediate,Engineering,English,16,150,Medium
Mechanics: Momentum and Energy,Learn about momentum and energy in this calculus-based physics course.,14846,Self-paced on your time,Intermediate,Physics,English,14,49,Low
Co-Creating Sustainable Cities,Learn how citizen’s co-creation is key in making cities worldwide more sustainable,12415,Self-paced on your time,Advanced,Social Sciences,English,8,49,Low
Cómo educar teniendo en cuenta la muerte,Pedagogía de la muerte para docentes y familias.,0,Self-paced on your time,Introductory,Education & Teacher Training,Español,3,49,Low
Introduction to Animal Ethics,"Learn about what ethical issues arise in human-animal relationships, and how to think about such issues systematically. The course utilizes Manga as a study aid.",6608,Self-paced on your time,Introductory,Philosophy & Ethics,English,5,49,Low
Teamwork & Collaboration,"Learn essential teamwork and collaboration skills to lead, build and motivate teams in the workplace.",0,Self-paced on your time,Introductory,Communication,English,3,199,High
Grant Writing and Crowdfunding for Public Libraries,"Learn how to increase your impact, innovate, and overcome often static funding through various fundraising and grant writing approaches.",12853,Self-paced on your time,Introductory,Humanities,English,4,49,Low
Leading Ambitious Teaching and Learning,This course is part of a MicroMasters® Program,24273,Self-paced on your time,Advanced,Education & Teacher Training,English,6,199,High
Financing Innovative Ventures,Demystify key financial concepts for creating a financial plan for your new venture to raise the right funding from the right partners at the right time,0,Self-paced on your time,Introductory,Business & Management,English,4,149,Medium
"A-level Mathematics for Year 13 - Course 2: General Motion, Moments and Equilibrium, The Normal Distribution, Vectors, Differentiation Methods, Integration Methods and Differential Equations","Develop your thinking skills, fluency and confidence to aim for an A* in A-level maths and prepare for undergraduate STEM degrees.",0,Self-paced on your time,Intermediate,Math,English,7,49,Low
Theories of Media and Technology,"Learn to apply media theory and practical, conceptual frameworks to design and digital media projects",0,Instructor-led on a course schedule,Introductory,Art & Culture,English,14,249,High
Introducción a la Estructura de la Materia,"Estudiaremos la estructura de la materia, los elementos que la forman y sus propiedades e introduciremos el concepto de la reacción química.",11859,Self-paced on your time,Introductory,Chemistry,Español,4,25,Low
"Batteries, Fuel Cells, and their Role in Modern Society",This course is an introduction to batteries and fuel cells - the cornerstones of electromobility and renewable energy.,11865,Self-paced on your time,Introductory,Science,English,6,49,Low
Communication Skills for Dialoguing Across Difference,Develop practical communication skills to mend divides and build a more tolerant and inclusive world.,60943,Self-paced on your time,Introductory,Communication,English,1,25,Low
Social Media: How Media Got Social,"Discover where social media came from, how it became integral to our everyday lives, and how that has changed the way we communicate.",13616,Self-paced on your time,Introductory,Communication,English,4,139,Medium
"Portfolio Management, Governance, & the PMO","Learn how a Project Management Office (PMO) works, discover techniques to monitor and control projects and find out how to keep your project portfolio healthy.",17299,Self-paced on your time,Introductory,Business & Management,English,6,199,High
edX101: Overview of Creating an edX Course,A quick course designed to help you explore all of the different steps that go into planning and building an edX course. Perfect for instructors or institutional leadership interested in building a MOOC on edX.,22327,Self-paced on your time,Introductory,Education & Teacher Training,English,1,99,Medium
"Soy docente, ¡qué miedo! Gestiona eficazmente tus emociones",,0,Self-paced on your time,Introductory,Education & Teacher Training,Español,4,49,Low
Data Analysis for Decision Making,"Use data analysis to gather critical business insights, identify market trends before your competitors, and gain advantages for your business.",8342,Instructor-led on a course schedule,Advanced,Business & Management,English,7,214,High
UML Class Diagrams for Software Engineering,Learn how unified modeling language (UML) class diagrams are created and used to visualize and conceptualize the design of a system.,33710,Self-paced on your time,Introductory,Computer Science,English,3,49,Low
Driving Digital Innovation through Experimentation,"Learn how to apply principles of experimentation at the technical, organizational and strategic levels of your business to drive digital innovation.",16904,Instructor-led on a course schedule,Advanced,Computer Science,English,6,399,High
Compilation Basics for Macroeconomic Statistics,"Better data leads to better policies.For policymakers to make sound policy decisions, they need a core set of macroeconomic and financial statistics. Learn the essential background concepts and basic tools needed to compile data using the best available methods.",6570,Self-paced on your time,Introductory,Data Analysis & Statistics,English,4,25,Low
Seguridad Vial en América Latina y el Caribe: de la teoría a la acción,Conoce los principales retos y herramientas de seguridad vial en America Latina y el Caribe. ¡Un curso de la region para la region con expertos de mas de 10 paises!,20189,Self-paced on your time,Introductory,Engineering,Español,10,25,Low
From Fossil Resources to Biomass: A Chemistry Perspective,"Explore how to create a sustainable future by moving away from dependence on fossil resources to biomass resources for the production of food, chemicals and energy-carriers. Discover how to use microorganisms and catalysts to create biobased products.",5464,Self-paced on your time,Advanced,Energy & Earth Sciences,English,5,149,Medium
System Dynamics for Health Sciences,Learn to use system dynamics to better understand complex medical issues and interventions.,15157,Self-paced on your time,Intermediate,Medicine,English,9,139,Medium
Internet de las cosas (IoT) y Big Data,"En este curso en línea aprenderas a desarrollar sistemas completos y escalables en IoT con el uso del Big Data y asi enriquece tu perfil profesional con una perspectiva global, bajo una de las tecnologías de mayor demanda en la actualidad.",0,Self-paced on your time,Intermediate,Data Analysis & Statistics,Español,4,49,Low
Introducción a Ciencias de Datos y Estadística Básica para Negocios,"En este curso adquirirás los métodos estadísticos para la toma de decisiones en los negocios, así como herramientas tecnológicas para desarrollar habilidades cuantitativas.",0,Self-paced on your time,Advanced,Data Analysis & Statistics,Español,4,49,Low
Introduction to Psychological Research Methods,"Learn how to plan, conduct and analyze psychological research and effectively communicate the results.",17087,Self-paced on your time,Introductory,Humanities,English,7,99,Medium
Sustainable Packaging in a Circular Economy,Learn how to apply the principles of the circular economy to sustainable packaging systems.,6277,Self-paced on your time,Intermediate,Design,English,6,50,Low
Design in Healthcare: Using Patient Journey Mapping,Learn about the Patient Journey Mapping method for innovative product and service design in healthcare.,17946,Self-paced on your time,Introductory,Design,English,8,129,Medium
"El manejo de plagas, malezas y enfermedades en los Sistemas de Siembra Directa","Desde el Manejo de plagas nos centraremos en definir el Monitoreo como un seguimiento secuencial en un período de tiempo, realizando muestreos de los mismos. Realizando un relevamiento y registro de la información pertinente con el objetivo de definir el manejo sanitario de un cultivo.",0,Self-paced on your time,Intermediate,Biology & Life Sciences,Español,4,99,Medium
"Electronic, Optical, and Magnetic Properties of Materials",This course is part of a XSeries Program,9717,Instructor-led on a course schedule,Advanced,Engineering,English,15,150,Medium
La España del Quijote,,13277,Self-paced on your time,Introductory,History,Español,7,19,Low
Risk Management for Projects,Learn how to manage risk in your organization by using the best processes and procedures.,22269,Self-paced on your time,Introductory,Business & Management,English,5,199,High
Smithsonian’s Objects That Define America,"Explore the history of America through the view of key historic objects, inventions, and exhibits in the Smithsonian collections.",9071,Self-paced on your time,Introductory,Humanities,English,5,50,Low
Creating Modern China: The Republican Period to the Present,Explore the birth of modern China with a focus on the time between the fall of the Qing and the end of World War II.,43045,Self-paced on your time,Introductory,History,English,15,139,Medium
Discover Political Science,Understand current political stakesas you learn about important concepts and how to analyze politics with a critical point of view.,6573,Instructor-led on a course schedule,Intermediate,Social Sciences,English,10,50,Low
Data Science: Inferential Thinking through Simulations,"Learn how to test hypotheses, draw inferences, and make robust conclusions based on data.",17505,Self-paced on your time,Introductory,Computer Science,English,5,199,High
Programming for Data Science,"Learn how to apply fundamental programming concepts, computational thinking and data analysis techniques to solve real-world data science problems.",41268,Self-paced on your time,Introductory,Computer Science,English,10,199,High
Public Sector Debt Statistics,"The course examines coverage and accounting rules for public sector debt, valuation, classification, important methodological issues, and the sources and methods used for compiling the statistics.",0,Self-paced on your time,Intermediate,Economics & Finance,English,6,25,Low
Sensor Fusion and Non-linear Filtering for Automotive Systems,Learn fundamental algorithms for sensor fusion and non-linear filtering with application to automotive perception systems.,9709,Instructor-led on a course schedule,Advanced,Engineering,English,6,299,High
Creación musical con Soundcool: Introducción,"Aprende los conceptos básicos para poder usar el sistema Soundcool para educación musical y creación colaborativa mediante móviles, tablets y Kinect.",0,Self-paced on your time,Introductory,Music,Español,5,30,Low
First Nights - Berlioz’s Symphonie Fantastique and Program Music in the 19th Century,"Learn about Hector Berlioz's Symphonie Fantastique, an iconic Romantic symphony that ushered in an era of narrative ""program music.""",8222,Self-paced on your time,Introductory,Humanities,English,3,49,Low
The Quantum Internet and Quantum Computers: How Will They Change the World?,Discover quantum computers and the quantum internet. Learn the principles and promises behind these developments and how they will impact our future.,15014,Self-paced on your time,Introductory,Science,English,6,50,Low
Research Methods: An Engineering Approach,Learn how to successfully design your research and understand the underlying principles of postgraduate research from an engineering perspective.,20444,Self-paced on your time,Introductory,Engineering,English,8,169,High
Idealismo filosófico y cosmovisiones: cómo hacer mundos con ideas,,15349,Self-paced on your time,Introductory,Philosophy & Ethics,Español,5,49,Low
Rise to Leadership: Become a CEO,Do you have what it takes to be a CEO? This courseexplores the key competencies that make the best CEOs effective leaders.,16719,Self-paced on your time,Intermediate,Business & Management,English,4,199,High
Building a Cybersecurity Toolkit,Develop a set of skills and characteristics that expand beyond technical proficiency to become a successful cybersecurity professional.,23275,Self-paced on your time,Introductory,Computer Science,English,6,199,High
Marketing your Android apps,"Creating and designing marketing activities to promote, monetize and increase the number of your app users.",0,Self-paced on your time,Intermediate,Engineering,English,5,49,Low
Embedded Systems Essentials with Arm: Getting Started,Get practical without hardware. Quickly prototype and build microcontroller projects using industry-standard APIs.,0,Self-paced on your time,Intermediate,Computer Science,English,6,149,Medium
